<?xml version='1.0' encoding='UTF-8'?>
<Model xmlns:xsi="http://www.w3.org/2001/XMLSchema-instance" schema_version="4.0.0.a" xsi:noNamespaceSchemaLocation="../../opgee/etc/opgee.xsd">
  <Analysis name="example">
    <A name="functional_unit">oil</A>
    <A name="GWP_horizon">100</A>
    <A name="GWP_version">AR5</A>
    <FieldRef name="gas_lifting_field"/>
  </Analysis>
  <Field name="gas_lifting_field" modifies="template">
    <A name="API">8.6</A>
    <A name="FOR">99.9</A>
    <A name="GFIR">166.5</A>
    <A name="GLIR">363.8</A>
    <A name="GOR">111.0</A>
    <A name="SOR">0.0</A>
    <A name="WIR">1.1</A>
    <A name="WOR">0.1</A>
    <A name="age">13.0</A>
    <A name="country">Venezuela</A>
    <A name="depth">2200.0</A>
    <A name="downhole_pump">1</A>
    <A name="ecosystem_richness">High carbon</A>
    <A name="field_development_intensity">High</A>
    <A name="flood_gas_type">NG</A>
    <A name="frac_CO2_breakthrough">59</A>
    <A name="frac_transport_barge">0.0</A>
    <A name="frac_transport_pipeline">1.0</A>
    <A name="frac_transport_rail">0.0</A>
    <A name="frac_transport_tanker">1.0</A>
    <A name="frac_transport_truck">0.0</A>
    <A name="frac_venting">0.002</A>
    <A name="fraction_elec_onsite">1.0</A>
    <A name="fraction_remaining_gas_inj">0.0</A>
    <A name="fraction_steam_cogen">0.0</A>
    <A name="fraction_steam_solar">0.0</A>
    <A name="fraction_water_reinjected">0.0</A>
    <A name="gas_comp_C1">91.9</A>
    <A name="gas_comp_C2">0.86</A>
    <A name="gas_comp_C3">0.39</A>
    <A name="gas_comp_C4">0.85</A>
    <A name="gas_comp_CO2">5.9</A>
    <A name="gas_comp_H2S">0.0</A>
    <A name="gas_comp_N2">0.1</A>
    <A name="gas_flooding">0</A>
    <A name="gas_lifting">0</A>
    <A name="gas_processing_path">Acid Wet Gas</A>
    <A name="name">Hamaca</A>
    <A name="natural_gas_reinjection">0</A>
    <A name="num_prod_wells">190</A>
    <A name="num_water_inj_wells">0</A>
    <A name="offshore">0.0</A>
    <A name="oil_processing_path">Upgrading</A>
    <A name="oil_prod">158441.0</A>
    <A name="oil_sands_mine">None</A>
    <A name="prod_index">10.0</A>
    <A name="prod_water_inlet_temp">140.0</A>
    <A name="res_press">950.0</A>
    <A name="res_temp">109.6</A>
    <A name="stabilizer_column">0</A>
    <A name="steam_flooding">0</A>
    <A name="transport_dist_barge">500.0</A>
    <A name="transport_dist_pipeline">140.0</A>
    <A name="transport_dist_rail">800.0</A>
    <A name="transport_dist_tanker">2443.0</A>
    <A name="transport_dist_truck">100.0</A>
    <A name="upgrader_type">Delayed coking</A>
    <A name="water_flooding">0</A>
    <A name="water_reinjection">0</A>
    <A name="well_diam">5.5</A>
    <Process class="CrudeOilDewatering">
      <A name="heater_treater">1</A>
    </Process>
    <Process class="HeavyOilDilution">
      <A name="fraction_diluent">0.0</A>
    </Process>
    <Aggregator name="ProductionExtraction">
      <ProcessRef class="CrudeOilDewatering"/>
    </Aggregator>
    <Aggregator name="SurfaceProcessing">
      <ProcessRef class="HeavyOilDilution"/>
    </Aggregator>
  </Field>
</Model>
